{
  "schemaVersion": "doppelganger.marketplace.plugin-record.v1",
  "recordId": "plugin:project-search",
  "providerId": "marketplace",
  "pluginId": "project-search",
  "displayName": "Project Search",
  "description": "Custom Plugin backed by an MCP stdio transport.",
  "version": "0.1.0",
  "kind": "mcp",
  "lifecycle": "installed",
  "enabled": true,
  "required": false,
  "connection": {
    "state": "connecting",
    "detail": "MCP adapter reload is awaiting runtime confirmation."
  },
  "contributions": [],
  "adapter": {
    "type": "mcp",
    "mcp": {
      "transport": "stdio",
      "command": "project-search-mcp",
      "args": ["--root", "/workspace"],
      "config": { "timeoutMs": 15000 }
    }
  },
  "capabilities": ["connector.observe", "connector.dispatch"],
  "actions": ["mcp.tools.list", "mcp.tools.call"],
  "allowedActions": ["disable", "configure", "update", "reload", "uninstall"],
  "settingsSurfaceIds": ["marketplace.plugin.project-search.settings"],
  "registry": {
    "authority": "doppelganger-registry",
    "unitId": "project-search",
    "contributionIds": []
  },
  "custom": true,
  "createdAt": "2026-07-10T00:00:00.000Z",
  "updatedAt": "2026-07-10T00:00:00.000Z"
}
